{
  "slug": "elimination-multipliers",
  "topic": "multipliers-from-elimination",
  "engine": "p5.js",
  "steps": 8,
  "example": {
    "A": [
      [
        2,
        3,
        1
      ],
      [
        4,
        7,
        7
      ],
      [
        -2,
        4,
        5
      ]
    ],
    "L": [
      [
        1,
        0,
        0
      ],
      [
        2,
        1,
        0
      ],
      [
        -1,
        7,
        1
      ]
    ],
    "U": [
      [
        2,
        3,
        1
      ],
      [
        0,
        1,
        5
      ],
      [
        0,
        0,
        -29
      ]
    ],
    "multipliers": [
      {
        "position": [
          1,
          0
        ],
        "value": 2,
        "operation": "R2 <- R2 - 2 R1"
      },
      {
        "position": [
          2,
          0
        ],
        "value": -1,
        "operation": "R3 <- R3 + 1 R1"
      },
      {
        "position": [
          2,
          1
        ],
        "value": 7,
        "operation": "R3 <- R3 - 7 R2"
      }
    ],
    "afterColumn1": [
      [
        2,
        3,
        1
      ],
      [
        0,
        1,
        5
      ],
      [
        0,
        7,
        6
      ]
    ],
    "pivots": [
      2,
      1,
      -29
    ],
    "det": -58,
    "dotCheck": {
      "rowOfL": 2,
      "columnOfU": 1,
      "terms": [
        -3,
        7,
        0
      ],
      "value": 4,
      "entryOfA": 4
    },
    "pivotingExample": {
      "A": [
        [
          0,
          2
        ],
        [
          1,
          3
        ]
      ],
      "P": [
        [
          0,
          1
        ],
        [
          1,
          0
        ]
      ],
      "PA": [
        [
          1,
          3
        ],
        [
          0,
          2
        ]
      ],
      "L": [
        [
          1,
          0
        ],
        [
          0,
          1
        ]
      ],
      "U": [
        [
          1,
          3
        ],
        [
          0,
          2
        ]
      ],
      "detP": -1,
      "detA": -2
    },
    "rules": [
      "the multiplier that clears position (i,j) is the current entry divided by the current pivot, and it goes into L at row i, column j",
      "the multipliers are computed from the working matrix, not from the original A",
      "the product L times U must reproduce A entry by entry",
      "det(A) is the product of the pivots, times the sign of any row permutation"
    ]
  }
}